{
  "$schema": "https://json-schema.org/draft/2020-12/schema",
  "type": "object",
  "additionalProperties": true,
  "required": ["status"],
  "properties": {
    "status": {
      "type": "string",
      "enum": ["completed", "failed", "partial"]
    },
    "summary": { "type": "string" },
    "ranking": {
      "type": "array",
      "items": {
        "type": "object",
        "properties": {
          "candidate_id": { "type": "string" },
          "score": { "type": "number" },
          "notes": { "type": "string" }
        }
      }
    },
    "artifacts": {
      "type": "array",
      "items": {
        "type": "object",
        "properties": {
          "path": { "type": "string" },
          "type": { "type": "string" },
          "title": { "type": "string" }
        }
      }
    },
    "next_actions": {
      "type": "array",
      "items": { "type": "string" }
    },
    "error": {
      "oneOf": [
        { "type": "null" },
        {
          "type": "object",
          "required": ["code", "message"],
          "properties": {
            "code": { "type": "string" },
            "message": { "type": "string" }
          }
        }
      ]
    }
  }
}
